OrganizationId,Id,JobId,Order,Text,ProjectId
1,1,1,1,"Pioneered the development and launch of mission-critical workflows, enhancing software reliability significantly.",2
1,2,1,2,"Architected the Geneva logging library, becoming a foundational tool for the Site Reliability Engineering (SRE) department.",2
1,3,1,3,"Crafted real-time dashboards using Geneva, handling data from millions of records for instant insights.",2
1,4,1,4,"Engineered and deployed complex Synapse workspaces with Bicep across multiple environments, optimizing deployment processes.",2
1,5,1,5,"Responsible for implementing integration testing patterns across multiple applications.",2
1,6,2,1,"Emerged as the company-wide leader for .NET initiatives, steering pivotal technology decisions and strategies.",NULL
1,7,2,2,"Revolutionized technical screenings and led numerous interviews, enhancing recruitment processes and team quality.",NULL
1,8,2,3,"Created a shared .NET codebase, significantly reducing development redundancy and boosting project efficiency.",NULL
1,9,2,4,"Awarded 'Top Developer of 2021' for exceptional productivity and innovation.",NULL
1,10,1,1,"Spearheaded the architecture of a model MicroService, setting new standards for future developments.",1
1,11,1,2,"Conducted hundreds of technical screenings for C# and Angular developers, refining the technical team’s capabilities.",1
1,12,2,1,"Overhauled an antiquated system using the latest .NET technologies, greatly improving performance and scalability.",5
1,13,2,2,"Seamlessly integrated an existing SQL Server database with EF Core, optimizing data operations and efficiency.",5
1,14,2,3,"Developed a robust gRPC-based messaging system using C# WebAPI, enhancing inter-service communication.",5
1,15,1,5,"Introduced advanced patterns for unit and integration testing, achieving 90% code coverage and setting a high standard for code reliability.",1
1,17,5,1,"Managed four developers directly using Agile Scrum methodologies."
1,18,5,2,"Responsible for the architecture and development of components within a banking platform."
1,19,5,3,"Developed Fingerprint Login and Friends and Family Shared Banking components."
1,20,2,1,"Responsible for the architecture and development of the .NET Core backend.",3
1,21,2,2,"Developed advanced medication and activity scheduling systems to accommodate complex care requirements.",3
1,22,2,3,"Made critical technology decisions that kept the project on track and within budgetary constraints.",3
1,23,2,4,"Maintained a code coverage of 90%, ensuring high reliability and quality of the software.",3
1,24,2,1,"Responsible for the entire backend and frontend architecture and development, including a .NET Core backend and Angular frontend.",4
1,25,2,2,"Developed a comprehensive single-entry accounting platform that calculates cash flow, tax savings, appreciation, and capital inflow.",4
1,26,2,4,"Maintained 75% code coverage.",4
1,27,2,3,"Made key technology decisions to ensure the project remained on schedule and within budget.",4
1,28,9,1,"Developed tools using C#, WCF, and XAML to support the Miami-Dade Police Department."
1,29,9,2,"Received extensive training in .NET, JavaScript, and WCF directly from Microsoft."
1,30,1,2,"Optimized ChatGPT training models to meet internal business needs.",2
1,31,3,1,"Responsible for the ideation, design, and delivery of a comprehensive professional services platform."
1,32,3,2,"Raised startup capital to fund company operations for three years."
1,33,3,3,"Managed a team of five developers to implement the flagship product."
1,34,3,1,"Developed a role-based business model that facilitates complex, multi-partner payouts from hours billed.",6
1,36,3,3,"Developed integrations with the Stripe payment system, PandaDoc document signing, and various other APIs.",6
1,37,4,1,"Reconstructed the flagship product, transitioning it from ASP to the .NET Framework to modernize infrastructure and improve scalability.",
1,38,4,2,"Developed a comprehensive order and scheduling system with full functionality.",
1,39,4,3,"Recruited, interviewed, and mentored developers at various levels, fostering a skilled and cohesive team.",
1,40,4,4,"Developed a comprehensive DevOps strategy to ensure compliance with international regulations.",
1,41,4,1,"Oversaw and managed the complete backend development process.",7
1,42,4,2,"Integrated with multiple bowling and card-reading systems to enhance overall system functionality.",7
1,43,4,3,"Developed a fully-featured order and scheduling system.",7
1,44,6,1,"Redesigned the flagship product by integrating advanced technology to enhance performance and functionality."
1,45,6,2,"Collaborated directly with the onsite team, providing mentorship to enhance skills and foster professional growth."
1,46,6,3,"Engineered numerous innovative features into the existing platform, significantly enhancing its capabilities and user experience."
1,47,6,4,"Specialized expertise in PCI Compliance and payment processing systems."
1,48,7,1,"Developed tools to facilitate the indexing of library archives.",8
1,49,7,2,"Spearheaded companywide adoption and training of jQuery.",
1,50,7,3,"Collaborated as a member of an 8-person development team utilizing Agile/Scrum methodologies.",8
1,51,7,4,"Maintained 100% code coverage.",8
1,53,8,1,"Oversaw the architecture, development, and deployment of a comprehensive affiliate marketing platform.",9
1,54,8,1,"Directly managed a team of up to 9 developers utilizing Agile Scrum methodologies.",10
1,55,8,2,"Oversaw the architecture, development, and deployment of a comprehensive e-learning platform.",10
1,56,8,2,"Ensured 99% uptime to maintain smooth business operations.",9

